{
  "schema_version": "1.0",
  "description": "Anticipated SEC filing schedule (10-Q / 10-K / 20-F) for universe equities calculated from statutory deadlines and fiscal year-ends.",
  "last_updated": "2026-08-28",
  "provenance": "TIER_1_PRIMARY_REGULATORY",
  "total_equities_tracked": 200,
  "calendar_entries": [
    {
      "symbol": "ABT",
      "company_name": "Abbott Laboratories",
      "cik": "0000000000",
      "fiscal_year_end": "12-31",
      "filer_category": "LARGE_ACCELERATED_FILER",
      "last_filed_form": "10-Q",
      "last_filing_date": "2026-04-29",
      "last_period_end": "2026-03-31",
      "next_expected_form": "10-Q",
      "next_expected_fiscal_period": "Q2",
      "estimated_filing_window_start": "2026-07-25",
      "estimated_filing_window_end": "2026-08-07",
      "statutory_deadline": "2026-08-09",
      "days_until_window_start": 0,
      "status": "OVERDUE",
      "sec_edgar_url": "https://www.sec.gov/edgar/browse/?CIK=1800"
    },
    {
      "symbol": "ADI",
      "company_name": "Analog Devices, Inc.",
      "cik": "0000000000",
      "fiscal_year_end": "11-01",
      "filer_category": "LARGE_ACCELERATED_FILER",
      "last_filed_form": "10-Q",
      "last_filing_date": "2026-05-20",
      "last_period_end": "2026-05-02",
      "next_expected_form": "10-Q",
      "next_expected_fiscal_period": "Q2",
      "estimated_filing_window_start": "2026-08-26",
      "estimated_filing_window_end": "2026-09-08",
      "statutory_deadline": "2026-09-10",
      "days_until_window_start": 0,
      "status": "IMMINENT_NEXT_14_DAYS",
      "sec_edgar_url": "https://www.sec.gov/edgar/browse/?CIK=6281"
    },
    {
      "symbol": "ADSK",
      "company_name": "Autodesk, Inc.",
      "cik": "0000000000",
      "fiscal_year_end": "01-31",
      "filer_category": "LARGE_ACCELERATED_FILER",
      "last_filed_form": "10-Q",
      "last_filing_date": "2026-05-29",
      "last_period_end": "2026-04-30",
      "next_expected_form": "10-Q",
      "next_expected_fiscal_period": "Q2",
      "estimated_filing_window_start": "2026-08-24",
      "estimated_filing_window_end": "2026-09-06",
      "statutory_deadline": "2026-09-08",
      "days_until_window_start": 0,
      "status": "IMMINENT_NEXT_14_DAYS",
      "sec_edgar_url": "https://www.sec.gov/edgar/browse/?CIK=769397"
    },
    {
      "symbol": "AEP",
      "company_name": "American Electric Power Company, Inc.",
      "cik": "0000000000",
      "fiscal_year_end": "12-31",
      "filer_category": "LARGE_ACCELERATED_FILER",
      "last_filed_form": "10-Q",
      "last_filing_date": "2026-05-05",
      "last_period_end": "2026-03-31",
      "next_expected_form": "10-Q",
      "next_expected_fiscal_period": "Q2",
      "estimated_filing_window_start": "2026-07-25",
      "estimated_filing_window_end": "2026-08-07",
      "statutory_deadline": "2026-08-09",
      "days_until_window_start": 0,
      "status": "OVERDUE",
      "sec_edgar_url": "https://www.sec.gov/edgar/browse/?CIK=4904"
    },
    {
      "symbol": "AMAT",
      "company_name": "Applied Materials, Inc.",
      "cik": "0000000000",
      "fiscal_year_end": "10-26",
      "filer_category": "LARGE_ACCELERATED_FILER",
      "last_filed_form": "10-Q",
      "last_filing_date": "2026-05-21",
      "last_period_end": "2026-04-26",
      "next_expected_form": "10-Q",
      "next_expected_fiscal_period": "Q2",
      "estimated_filing_window_start": "2026-08-20",
      "estimated_filing_window_end": "2026-09-02",
      "statutory_deadline": "2026-09-04",
      "days_until_window_start": 0,
      "status": "IMMINENT_NEXT_14_DAYS",
      "sec_edgar_url": "https://www.sec.gov/edgar/browse/?CIK=6951"
    },
    {
      "symbol": "ASML",
      "company_name": "ASML Holding N.V.",
      "cik": "0000000000",
      "fiscal_year_end": "12-31",
      "filer_category": "LARGE_ACCELERATED_FILER",
      "last_filed_form": "20-F",
      "last_filing_date": "2026-02-25",
      "last_period_end": "2025-12-31",
      "next_expected_form": "6-K",
      "next_expected_fiscal_period": "Semi-Annual / Interim",
      "estimated_filing_window_start": "2026-05-06",
      "estimated_filing_window_end": "2026-05-26",
      "statutory_deadline": "2026-05-31",
      "days_until_window_start": 0,
      "status": "OVERDUE",
      "sec_edgar_url": "https://www.sec.gov/edgar/browse/?CIK=937966"
    },
    {
      "symbol": "AVGO",
      "company_name": "Broadcom Inc.",
      "cik": "0000000000",
      "fiscal_year_end": "11-02",
      "filer_category": "LARGE_ACCELERATED_FILER",
      "last_filed_form": "10-Q",
      "last_filing_date": "2026-06-09",
      "last_period_end": "2026-05-03",
      "next_expected_form": "10-Q",
      "next_expected_fiscal_period": "Q2",
      "estimated_filing_window_start": "2026-08-27",
      "estimated_filing_window_end": "2026-09-09",
      "statutory_deadline": "2026-09-11",
      "days_until_window_start": 0,
      "status": "IMMINENT_NEXT_14_DAYS",
      "sec_edgar_url": "https://www.sec.gov/edgar/browse/?CIK=1730168"
    },
    {
      "symbol": "BETA",
      "company_name": "Beta Technologies, Inc.",
      "cik": "0000000000",
      "fiscal_year_end": "12-31",
      "filer_category": "LARGE_ACCELERATED_FILER",
      "last_filed_form": "10-Q",
      "last_filing_date": "2026-05-12",
      "last_period_end": "2026-03-31",
      "next_expected_form": "10-Q",
      "next_expected_fiscal_period": "Q2",
      "estimated_filing_window_start": "2026-07-25",
      "estimated_filing_window_end": "2026-08-07",
      "statutory_deadline": "2026-08-09",
      "days_until_window_start": 0,
      "status": "OVERDUE",
      "sec_edgar_url": "https://www.sec.gov/edgar/browse/?CIK=0001784570"
    },
    {
      "symbol": "CCEP",
      "company_name": "Coca-Cola Europacific Partners PLC",
      "cik": "0000000000",
      "fiscal_year_end": "12-31",
      "filer_category": "LARGE_ACCELERATED_FILER",
      "last_filed_form": "20-F",
      "last_filing_date": "2026-03-13",
      "last_period_end": "2025-12-31",
      "next_expected_form": "6-K",
      "next_expected_fiscal_period": "Semi-Annual / Interim",
      "estimated_filing_window_start": "2026-05-06",
      "estimated_filing_window_end": "2026-05-26",
      "statutory_deadline": "2026-05-31",
      "days_until_window_start": 0,
      "status": "OVERDUE",
      "sec_edgar_url": "https://www.sec.gov/edgar/browse/?CIK=1650107"
    },
    {
      "symbol": "CDNS",
      "company_name": "Cadence Design Systems, Inc.",
      "cik": "0000000000",
      "fiscal_year_end": "12-31",
      "filer_category": "LARGE_ACCELERATED_FILER",
      "last_filed_form": "10-Q",
      "last_filing_date": "2026-05-01",
      "last_period_end": "2026-03-31",
      "next_expected_form": "10-Q",
      "next_expected_fiscal_period": "Q2",
      "estimated_filing_window_start": "2026-07-25",
      "estimated_filing_window_end": "2026-08-07",
      "statutory_deadline": "2026-08-09",
      "days_until_window_start": 0,
      "status": "OVERDUE",
      "sec_edgar_url": "https://www.sec.gov/edgar/browse/?CIK=813672"
    },
    {
      "symbol": "CRM",
      "company_name": "Salesforce, Inc.",
      "cik": "0000000000",
      "fiscal_year_end": "01-31",
      "filer_category": "LARGE_ACCELERATED_FILER",
      "last_filed_form": "10-Q",
      "last_filing_date": "2026-05-28",
      "last_period_end": "2026-04-30",
      "next_expected_form": "10-Q",
      "next_expected_fiscal_period": "Q2",
      "estimated_filing_window_start": "2026-08-24",
      "estimated_filing_window_end": "2026-09-06",
      "statutory_deadline": "2026-09-08",
      "days_until_window_start": 0,
      "status": "IMMINENT_NEXT_14_DAYS",
      "sec_edgar_url": "https://www.sec.gov/edgar/browse/?CIK=1108524"
    },
    {
      "symbol": "CRWD",
      "company_name": "CrowdStrike Holdings, Inc.",
      "cik": "0000000000",
      "fiscal_year_end": "01-31",
      "filer_category": "LARGE_ACCELERATED_FILER",
      "last_filed_form": "10-Q",
      "last_filing_date": "2026-06-04",
      "last_period_end": "2026-04-30",
      "next_expected_form": "10-Q",
      "next_expected_fiscal_period": "Q2",
      "estimated_filing_window_start": "2026-08-24",
      "estimated_filing_window_end": "2026-09-06",
      "statutory_deadline": "2026-09-08",
      "days_until_window_start": 0,
      "status": "IMMINENT_NEXT_14_DAYS",
      "sec_edgar_url": "https://www.sec.gov/edgar/browse/?CIK=1535527"
    },
    {
      "symbol": "CSIQ",
      "company_name": "Canadian Solar Inc.",
      "cik": "0000000000",
      "fiscal_year_end": "12-31",
      "filer_category": "LARGE_ACCELERATED_FILER",
      "last_filed_form": "20-F",
      "last_filing_date": "2026-04-10",
      "last_period_end": "2025-12-31",
      "next_expected_form": "6-K",
      "next_expected_fiscal_period": "Semi-Annual / Interim",
      "estimated_filing_window_start": "2026-05-06",
      "estimated_filing_window_end": "2026-05-26",
      "statutory_deadline": "2026-05-31",
      "days_until_window_start": 0,
      "status": "OVERDUE",
      "sec_edgar_url": "https://www.sec.gov/edgar/browse/?CIK=1375877"
    },
    {
      "symbol": "CTAS",
      "company_name": "Cintas Corporation",
      "cik": "0000000000",
      "fiscal_year_end": "05-31",
      "filer_category": "LARGE_ACCELERATED_FILER",
      "last_filed_form": "10-Q",
      "last_filing_date": "2026-04-07",
      "last_period_end": "2026-02-28",
      "next_expected_form": "10-K",
      "next_expected_fiscal_period": "FY (Full Year)",
      "estimated_filing_window_start": "2026-07-09",
      "estimated_filing_window_end": "2026-07-27",
      "statutory_deadline": "2026-07-29",
      "days_until_window_start": 0,
      "status": "OVERDUE",
      "sec_edgar_url": "https://www.sec.gov/edgar/browse/?CIK=723254"
    },
    {
      "symbol": "CTSH",
      "company_name": "Cognizant Technology Solutions Corporation",
      "cik": "0000000000",
      "fiscal_year_end": "12-31",